{
  "schema_version": "model-evaluation.v1",
  "evaluation_id": "demo-evaluation-001",
  "model_type": "classifier",
  "model_version": "classifier-demo-2026-09-21-001",
  "dataset_version": "demo-2026-09-21.v1",
  "evaluation_version": "demo-evaluation.v1",
  "split_version": "demo-split.v1",
  "evaluation_type": "OFFLINE",
  "status": "INSUFFICIENT_DATA",
  "sample_count": 0,
  "metrics": {},
  "critical_regressions": [],
  "created_at": "2026-09-21T00:00:00Z",
  "evaluator": "demo_fixture",
  "synthetic": true
}
